Timestamp	Seconds	Text
0:06	6	[Music]
0:20	20	[Music]
0:46	46	heat Heat [Music]
1:03	63	[Music]
1:38	98	[Music]
1:44	104	[Music]
2:20	140	[Music]
2:41	161	[Music]
2:53	173	[Music]
3:10	190	[Music]
3:18	198	[Music]
3:32	212	[Music]
4:01	241	[Music]
4:15	255	[Music]
4:25	265	[Music]
4:33	273	[Music]
5:10	310	[Music]
5:30	330	Hello and welcome to this our 208th live dream The hysterical context
5:39	339	error Of course this is a play on our Monday video which is the historical
5:45	345	context error Okay not to be confused Historical not to be confused with
5:50	350	hysterical On the live streams we do hysterical errors On the um on the
5:56	356	teaching videos we talk about historical context errors Okay just want to make
6:03	363	that clear Okay this is of course our Friday night live stream where we come
6:08	368	to you and answer your questions on ancient Egypt in the Bible Thank you very much for joining us tonight And uh
6:15	375	just a little bit of housekeeping Uh first of all uh we want to remind you
6:20	380	that this coming Wednesday we're doing a special live stream at 8:00 p.m Pacific
6:26	386	where we talk about the novel I'll just throw it up here uh Reloquy of the Dead
6:33	393	And in this live stream what we're going to do is we are going to answer all your questions regarding the novel Did you
6:40	400	read it and found something interesting did you want to know about the background of a particular person or
6:48	408	event this is your opportunity to come on the live stream and ask So that's
6:55	415	this Wednesday again at 8:00 PM And we're just going to be talking in this live stream We're just going to be
7:01	421	talking about the novel No ancient neareastern stuff unless it relates to the novel Okay
7:09	429	So we uh hope you'll see you there And again this is again just to talk about
7:16	436	the novel All right Uh we're happy also to announce that the novel is actually
7:21	441	doing very well It's received very very high praise so far and we are grateful
7:27	447	for that And if any of you guys have read it please leave a review because reviews really matter Okay let's talk
7:34	454	about the rules of the channel Then start getting into your questions Uh the rules are the same as always Super chats
7:41	461	have priority Same across all YouTube channels Doesn't guarantee your question gets answered but it does guarantee that
7:48	468	it gets seen Okay If you want to ask a non-sup chat uh question you have to put
7:54	474	a Q and a colon in front of it So we see it No Q no colon Might as well not exist
8:00	480	as far as we can tell Okay Uh only post your non-s super chats once Question
8:06	486	spamming is not allowed and will be disqualified Also if it's a something to
8:12	492	do with the Bible please give us a little bit of context Give us the what book it's from the chapter and the verse
8:19	499	That way we don't have to go hunting for it or guess Also uh we do allow
8:26	506	uh sponsorship of non-s super chat questions and if you sponsor a question
8:32	512	please uh put a copy of the question in your super chat so we again we don't
8:38	518	have to hunt for it makes things just a lot easier for us And then finally one
8:43	523	question per chat Uh no question stacking because there's just no way we can reasonably answer that So again
8:51	531	restrict your question to one question per chat Okay with that said let's get
8:57	537	into the questions Okay our first question of the
9:03	543	night is going to be coming from Joseph aptly named and he asks "Did
9:12	552	Egyptians actually think the brain was useless?" The answer to that is a surprisingly no They didn't think it was
9:19	559	useless They just weren't exactly sure what it did
9:25	565	Now why do we know this okay the reason why is because of surgical manuals Uh
9:31	571	and the particular surgical man manual is the Edwin Smith Papyrus So they did do surgery on the
9:39	579	brain to repair certain things from happening For example they knew enough
9:45	585	about say the function of the brain that they could do tonation which is a kind
9:52	592	of brain surgery where they open up a circle in the skull and remove part of the brain uh often a tumor So they they
10:00	600	understood that when the brain malfunctioned the rest of the person was not healthy Okay So they didn't think
10:07	607	the brain was useless At the same time too there wasn't a
10:12	612	practical way to extract the brain for say um
10:19	619	mummification So in that respect um they needed to
10:25	625	do when they when they mummified a body they couldn't take the brain out
10:30	630	So what ended up happening was usually that the brain was left in the skull and as the mummy dehydrated it just formed a
10:38	638	film inside the skull So
10:44	644	uh Gabe Reagan says "I don't know if I trust Bronze Age brain
10:50	650	surgery." Yeah but their patients survived uh we got lots of examples of of skulls
10:57	657	where they had performed tponation and it started
11:03	663	healing over you know there's evidence of the blood uh bone starting to knit back up so uh even though as as I said
11:12	672	very crude uh I and I wouldn't trust it myself but they it was an effective
11:21	681	treatment when it was targeting the right place
11:29	689	So Mama says "Wow I always thought that they did the hook through the nose
11:35	695	mashup thing." No And they that was a myth for a long time Uh many many people
11:41	701	still believe it today In fact many Egyptologists still believe it But um recent studies have shown that they
11:49	709	didn't go up the nose with a hook or anything like that what they did was they just left it there Um the problem
11:56	716	was that when 19th century um Europeans started cutting open
12:02	722	mummies they couldn't find a brain in it But that's they've they've now looked
12:07	727	using um using MRIs They can now see the film of the brain uh that aderes to the
12:14	734	side of the skull So yeah the whole the whole idea that
12:19	739	they went up the nose with a hook and drained out the brain is a myth Okay Um
12:25	745	but it's again this is this is these are recent findings These are recent findings that have shown that the that
12:30	750	they just didn't do anything with the
12:40	760	brain Um where's that okay I see that uh 811
12:47	767	Okay Michael Price did they know about the use of metal plates to counter infection naturally apparently they
12:53	773	didn't They didn't use metal plates uh which was not sure what they used but we
13:00	780	don't see any evidence of metal plates or any replacement for the skull So they
13:06	786	would cut it open and just I don't know if they they sewed it back over or what It's not clear exactly what sort of
13:14	794	post-operative treatment they did but they don't seem to have used metal plates
13:21	801	here Yeah Yeah Um it's possible they left it open It's possible they just sewed the skin in shut We don't know We
13:29	809	don't know exactly how they did it but they don't seem to have used a
13:35	815	metal plate Okay
13:43	823	uh nor wood There's no evidence that they used wood or
13:48	828	either uh in fact again uh the evidence seems to be that the that the bone
13:54	834	started to actually knit across the wound So if you have a metal plate there
13:59	839	that would interfere with with the knitting it So it doesn't appear to be any sort of of
14:05	845	um filler substance there So they just they just left it Again they might have
14:12	852	covered the sewn up the skin over it but once they sewed up the skin over it they sort of just left
14:20	860	it Okay So I think that covers the question So they did think that the that
14:27	867	the brain had a use They just didn't know what it
14:32	872	was Okay Okay the next question here is from Harry Stark and he asks a personal
14:39	879	question After David told his secular friends he was a Christian were there any of them surprised what are you a
14:46	886	Christian um no They're okay I never really told friends I was a
14:53	893	Christian Um it sort of just came up in casually in conversation So there wasn't any huge
15:01	901	like I'm a Christian guys No no no I didn't do that Okay And it's not
15:09	909	like I didn't talk religion with my secular friends Okay It was just just
15:15	915	sort of came up naturally So there there wasn't a there wasn't any
15:21	921	sort of shocking revelation there for them to
15:26	926	gasp you know you know you know you know we'd be
15:32	932	sitting around a a fire somewhere and you know yeah we we'd talk about you know uh do you believe in God yeah sure
15:40	940	Some of them said nah no not me It just it would just it would just be like that
15:45	945	where it would just just came up casually
15:51	951	So you know not everything has to be a a
15:57	957	um a dramatic monologue [Laughter]
16:07	967	moment This is like Yeah No no I mean too many people live their life with
16:12	972	drama anyway You know why does everything have to be a moment of drama of drama
16:23	983	okay you know if you don't present something with drama people are not going are less likely to respond with
16:29	989	drama Okay Just saying Just saying
16:39	999	Yeah Okay So uh yeah when my when my friends
16:45	1005	found out I was Christian it wasn't a surprise Um it just wasn't an issue
16:51	1011	though either So um hope that helps answer that
16:58	1018	question Now I will say one time it was a surprise Okay I will mention one
17:04	1024	person to whom it was a surprise Um there was a guy when I was working at Tap Pharmaceuticals whom I
17:11	1031	used to play chess with Okay And this guy was was one of those
17:19	1039	um say this He would be what we would call today a blue sky
17:25	1045	liberal Okay He was as as liberal as it came I mean far-left
17:33	1053	liberal and you know we we talked and uh you know eventually it turned to things
17:38	1058	like religion and stuff and you know he was I had managed to beat him four games
17:44	1064	out of five in chess and uh finally he asked me the question you
17:51	1071	know it's like you're you're smart and you're a Christian it's like
18:00	1080	[Laughter] Yes He's like "You're really
18:07	1087	smart." Yes I don't see how that could that's
18:12	1092	mutually exclusive to being Christian But hey he was surprised He was really
18:20	1100	surprised uh because he had such a low view of Christians that he think that he thought that no no Christian would be
18:28	1108	smart enough to beat him at chess let alone do that four out of five
18:39	1119	times Yeah he was surprised But hey
18:49	1129	That's the only person I I can think of that was really really shocked
18:56	1136	He was also stunned I beat him a chest too Yeah
19:03	1143	Okay So um yeah nobody's been surprised who's who's known me for any length of
19:09	1149	time Uh except for that one guy Okay Next question here comes from
19:17	1157	Mobius Uh and he asks "Considering how far back in time the history of Jericho
19:22	1162	goes isn't it odd that nothing from Abraham to Jacob mentions
19:27	1167	it?" Well that's actually not surprising Um Jericho was really a a
19:38	1178	a fortress that guarded the fords of the Jordan That was its purpose
19:45	1185	It was to prevent entry across the forts Okay And a fort is basically a low point
19:52	1192	in the river where you can cross on foot Okay Uh at Jericho there it it's it's
20:00	1200	right near those forts So it was Jericho was set up there
20:05	1205	to prevent people from coming in into Canaan
20:11	1211	Okay Through that entry port Okay Uh Abraham and Jacob didn't come through
20:18	1218	the fords of the of of the Jordan Okay they came north uh from the north
20:24	1224	through Syria At least Abraham did And Jacob was inside of Canaan
20:31	1231	already Um so neither Abraham nor Jacob ever had to
20:39	1239	cross the fords of the Jordan Okay because they never had to cross the fords of the Jordan There would have
20:45	1245	been no reason for them to have encountered Jericho So it was just not not near the
20:52	1252	anywhere where they were sort of sojurning You wouldn't take your flocks
20:57	1257	there I mean Jordan would be a horrible place to take flocks Uh so you know there's just no
21:04	1264	reason for them to go to Jericho
21:13	1273	So so you know it's it's not surprising that they didn't talk about I mean I
21:18	1278	mean Abraham sort of he was more around Hebron uh than than
21:23	1283	than Jericho So this is why they talk more about Hebrron
21:29	1289	too because they're going to be in areas both the patriarchs are going to be
21:35	1295	living in areas where your pasture flocks and Jericho is just not that place Okay so I hope that helps Thank
21:43	1303	you for the question Very much appreciate it Okay the next question here is
21:52	1312	uh from Mary Stark and this will be the last known super chat for the beginning segment here and he asks "Have book
21:59	1319	critics said anything about the novel?" Yes one book critic has Um there was a
22:06	1326	book critic on um Twitter who you know
22:12	1332	basically he he does he he does book uh reviews of um Christian
22:19	1339	fiction and he had um uh reviewed my book at the same time as he reviewed a
22:25	1345	book by um Shirley Johnson and John Delaros Okay
22:33	1353	And oh he had very high praise for it He had very high praise for it
22:38	1358	Uh yeah it's it is it is the one we posted in the community post Um yep
22:44	1364	that's the one Uh yeah I've been asked to read it Okay
22:50	1370	so um you can always go back and read this yourself but it is a very very funny review
22:57	1377	So uh he titles this reviews of novels that you as a Christian can enjoy and
23:02	1382	give your youngans That's fair enough He says I
23:08	1388	read Reloy of the Dead by Dr David A Faulk Overall a delightful novel Also
23:13	1393	one that gives me an excuse to talk about two potential pitfalls in pi in fiction writing
23:20	1400	The first is that specialists in any field other than fiction writing tend
23:25	1405	not to make very good fiction writers I agree with him totally here I've read some novels by
23:32	1412	um academic writers and they're awful normally Okay He says they tend to be
23:38	1418	didactic regarding their field of interest and not very convincing in terms of character and plot They also
23:45	1425	tend to be narrowly educated in their field with little experience or knowledge to inform other elements of
23:51	1431	their story resulting in glaring plot holes and technical
23:57	1437	mistakes Dr Faulk divi delightfully averts this
24:02	1442	trope demonstrating passible knowledge in a wide range of subjects need for a
24:08	1448	story which is a space exploration adventure with aliens Well part of the
24:13	1453	reason why I'm able to avoid this is I actually did fiction writing long before
24:19	1459	I did academic w So I've been writing fiction since my
24:26	1466	teens So and I didn't get into the um into doing academic work until my 30s So
24:33	1473	I've been writing fiction for decades prior to my ever getting into uh
24:39	1479	academia So that's one of the reasons why I was able to avoid that He continues "Color me surprised An
24:48	1488	outer space ancient aliens romp from an actual Egyptologist and it's actually
24:54	1494	good and fun and not bogged down by attempts to
24:59	1499	teach us all how much everyone else gets wrong about ancient Egypt." And I concur
25:04	1504	You know that wouldn't be fun In fact there's almost no ancient Egypt in it This is a good thing on Dr Folk's
25:12	1512	part especially for a Dave Bume novel It frees him to do what all
25:18	1518	fiction writers do write as non-PhDs based on research but with a focus on
25:23	1523	character plot and fun which is the point You know to introduce people to
25:29	1529	archaeology in a manner that's fun Okay
25:34	1534	He then goes on um which leads me to another phenomenon
25:41	1541	that tends to plague fiction writers Their sense of human psychology tends to be
25:47	1547	autobiographical The famous example of this is Lord of the Flies depicting the breakdown into savagery and tribalism of
25:53	1553	young boys on a resourcerich island Build as an insightful indictment
25:59	1559	of human nature It really ends up being an insightful window into the author's
26:05	1565	nature And meanwhile a group of actual school boys gets stranded on an island for
26:11	1571	months and has prayer every night and takes care of its members until dramafree
26:17	1577	rescue The human condition is widely varied and authors write what they know
26:23	1583	They write as if all people are the kind of people with whom they are familiar
26:29	1589	Apparently the kind of people Dr Faulk knows are
26:35	1595	a-holes Well
26:40	1600	um he goes "Our protagonist and every character he encounters are socially
26:45	1605	inept backstabbing children in adult bodies." Okay now not everyone I know is
26:53	1613	an a-hole okay but I did encounter an awful lot of them Especially when I
26:59	1619	worked in IT when I worked in corporate America it was much much it was just
27:06	1626	comical how many uh uh socially inept backstabbing
27:12	1632	children and adult bodies I encountered Then he asks "Is academia of
27:20	1640	ancient Egypt really so backbiting?" Um not so much Egyptology although there's
27:26	1646	some of that Uh theology Oh yeah Oh yeah
27:31	1651	In in theology and Christian seminaries oh yeah academia is that bite
27:37	1657	biting We must presume so And wonder if Dr Faulk needs a hug
27:43	1663	Yes I need a hug That said while the entire cast are
27:49	1669	steadfastly unlikable we yet manage to come to like the protagonist and his loyal assistant Gunhand and root for
27:56	1676	them The level of character development here is on par for commercial fiction but entertainingly
28:04	1684	idiosyncratic Dr Folk proposes that to resolve a politically sensitive and
28:10	1690	technically demanding crisis in a space colony on the verge of collapse you need a man with a particular set of skills
28:17	1697	And those are the skills of a socially inept Egyptologist And yet he just about pulls
28:24	1704	it off at least well enough to keep us entertained and intrigued by his particular twist on the ancient alien
28:31	1711	concept Lastly given the abrupt ending expect a
28:36	1716	series which is true The second book is already in pre-order Entertaining And it concludes
28:43	1723	here Entertaining thoughtprovoking educational minimal bad language and no lascivious content Fit for Christian
28:50	1730	audiences Enjoy
28:55	1735	Okay So that was one critic that who who reviewed my book and and it was a very
29:02	1742	positive uh review So yes
29:08	1748	uh we have had one critic review the book but only one so far But it was a very very positive
29:15	1755	review In fact all the all the reviews we've gotten so far have been extremely positive
29:25	1765	Uh Warrior of the Most High Wait a minute So this book is actually your take on ancient
29:30	1770	aliens yes sort of
29:37	1777	Yes And why not you know why not
29:42	1782	bc I'm not saying it was aliens but hey if you're going to do an ancient
29:49	1789	alien twist you know why why not i mean it's as as long as you you don't think it's real And I don't think I don't
29:56	1796	think the whole ancient alien thing is real but you know why not explore that
30:02	1802	as well what if it were real you know how could how would that play into man's
30:09	1809	explorations to the stars it could be very very
30:16	1816	interesting Okay So uh we have had as I said one uh critic review it and review
30:23	1823	it very positively So we're very thankful for
30:29	1829	that But here's the thing Um as long as you're able to separate fiction from
30:34	1834	reality yeah I don't mind I don't mind entertaining the possibility as a sort
30:39	1839	of a fictional well what
30:45	1845	if I think that's perfectly appropriate and perfectly okay But don't confuse it
30:52	1852	for
30:59	1859	reality Yeah Dossman says Stargate is a fun movie not a documentary
31:06	1866	Exactly Exactly It's not a documentary It's a fun movie
31:11	1871	though And I can I can appreciate movies that that that take that ancient aliens
31:16	1876	concept and play with it just on a matter of
31:22	1882	fiction but I would never say that aliens built the pyramids I mean I think that would that's
31:28	1888	stupid So it's like um but you know there are there are
31:34	1894	other ways you could play with the ancient alien concept and produce an intriguing kind of uh science fiction
31:41	1901	from it So and that's where we go with this this this series of novels Um are
31:47	1907	ancient aliens kind of more border on not only alien races but also
31:54	1914	spirit critters too Yeah we'll talk about more of this on Wednesday when we actually do the
32:01	1921	live stream on this Okay so let's get back to our questions here Our first super chat here is from
32:11	1931	uh Joseph for $2 Thank you for the super chat book recommendations for NT use of
32:17	1937	the Old Testament Unfortunately I don't have one
32:22	1942	Um there was supposed to be one that sounded really good at least in its premise that was
32:29	1949	supposed to be a cooperative effort between uh DA Carson and Treer
32:35	1955	Longman the third It for some reason just never went off I don't know what happened with that
32:42	1962	I had heard that there was an agreement between the two to produce a book that uh say went through
32:52	1972	um the New Testament and sort of ask the question um you know how does it how do
33:00	1980	these New Testament passages reference the Old Testament and for some bizarre reason
33:07	1987	the project never never went to fruition So I don't know if it was a fact that
33:13	1993	they couldn't get funding to complete it or what but
33:18	1998	um it just never happened It just never happened And that's I think it's really unfortunate cuz that could have been a
33:24	2004	really good resource but unfortunately um I don't know if it was turning out
33:31	2011	too long or somebody bowed out Um it could have been uh Longman who who bowed
33:37	2017	out of this because I heard he hasn't uh he had sort of um some sketchy health
33:42	2022	issues at that time So but I don't think there's anyone who's done a really really good job of
33:48	2028	this so far but there might be some some
33:54	2034	uh some other resources available out there that could help on this but I don't happen to know any off the top of my
34:00	2040	head Okay So thank you very much for the super
34:05	2045	chat but that's about the best I could do unfortunately It needs to happen though It needs to
34:12	2052	happen Okay Andrew Tinsley for $10 Thank you for the super
34:17	2057	chat What would have the Israelites have done during the 40 years in the desert
34:23	2063	mana would mean they didn't have to work much for food That's actually not true But
34:28	2068	uh would it be boring enough to be worse than slavery in Egypt uh okay They still
34:37	2077	had to work for food Um it's kind of a myth that um you know the mana just came
34:42	2082	and that's all they ate Um their diet did not just consist of of
34:50	2090	mana Now they did eat a lot of mana And there was an actually an I heard
34:57	2097	there was an interesting proposal um for what was uh mana
35:05	2105	um a micologist just recently talked about the desert truffle which is a kind of fungus that
35:11	2111	appears out on in savas Um and and I had thought when I
35:18	2118	when I read the the um the wandering in the desert in the mana that it it
35:24	2124	sounded a lot like fungus Anyway and the fact that somebody has identified a
35:30	2130	fungus that behaves like this I think is incredibly
35:36	2136	interesting Okay Now with that said
35:43	2143	um these people are not just sitting around collecting mana okay uh yes they
35:48	2148	are out there collecting mana and it's work okay it's work but they still have flocks to to to feed flocks to f to tend
35:58	2158	They have to go uh to drive their flocks to water and to silage They're still working okay
36:06	2166	they're not they're not sitting on their hands okay just because mana is feeding them doesn't mean they have they they
36:12	2172	they can just let the flock starve So they're still working They're
36:18	2178	still making tents They're still making still making clothes
36:24	2184	Yep They they have to still do the things of life Okay
36:31	2191	So so it might not be as interesting as living in Egypt but uh they still had a
36:39	2199	lot of work They kept busy Okay So
36:46	2206	um it's it's not a life of boredom It's it's a life of tedium And that's
36:52	2212	probably a better way of saying it
37:04	2224	Yep Um Dark Blade asks "Uh would there have been regular sacrifices during the wandering period?" There would have been
37:11	2231	some sacrifices um because you do have say uh the
37:16	2236	tabernacle So as long as the tabernacle was set up there'd be sacrifices So
37:29	2249	Um what do you make of the verse that says their gear didn't wear out i wouldn't take that as an absolute
37:36	2256	Okay It's more along the lines that God was kept supplying them in gear
37:44	2264	Okay So it was like it didn't wear out because there was always replacements
37:49	2269	Okay It's not that that they went out with one set of shoes and 40 years later
37:57	2277	entered the promised land with the same set of shoes Okay it's not like
38:02	2282	that It's more like that the Lord kept providing along the way Okay so they
38:09	2289	didn't suffer loss as they wandered out into the wilderness Okay
38:17	2297	so so I think I think that's a lot of it is it's it's it's an it's a naive
38:25	2305	reading to say that the that the that their clothes and their their shoes just didn't wear out at all Okay It's as I
