Timestamp	Seconds	Text
3:05:24	11124	the super chat How similar is the creator God ta compared to Yahweh in the
3:05:31	11131	Bible only similar in one respect Okay Um the only similarity between Ta and
3:05:39	11139	Yahweh is the idea of fiat creation Okay Now what is fiat creation fiat creation
3:05:48	11148	is the idea that you can create through the power of your voice or your thoughts
3:05:57	11157	Okay Uh in the um Shabbaka Stila
3:06:03	11163	uh there on the Shabbaka stone there is this um sort of contest between the
3:06:10	11170	Mefit theology under Ta and the Helopllin theology under
3:06:16	11176	Rey And basically it's a sort of a a contest of who's the better
3:06:22	11182	god And Basically Ta says you know the me fights
3:06:28	11188	go "Oh Ta is the better god because he's he's he creates through his thoughts and
3:06:34	11194	through the power of his uh voice." The sun god Rey is the inferior
3:06:41	11201	god because he creates through the male sex act
3:06:48	11208	Okay So um that's about the only similarity
3:06:54	11214	though between Ta and Yahweh is Yahweh says "Let there be light." And there was
3:07:01	11221	light You know let Yahweh creates the power of his
3:07:06	11226	voice Ta also creates the power of his voice So so that's that's that's the only
3:07:14	11234	similarity between Now everything else is different between the two
3:07:19	11239	Okay yahweh is a transcendent God Ta lives inside his creation He's an
3:07:26	11246	imminent God Um Yahweh doesn't have a body Ta is
3:07:32	11252	a has a body and he's a mummy He's essentially a dead person wrapped up
3:07:38	11258	Okay So so that's where the similarities end
3:07:45	11265	is just that's the only point where the two are similar is in that one sort of of intersection of fiat creation That's
3:07:52	11272	the only way they're similar Okay so I hope that helps Thank you very much for the super chat Very much appreciate
3:08:00	11280	it All right Esther again for $5 Thank you very much for the super chat How would the disciples have understood
3:08:06	11286	Mark 8:34 before the crucifixion okay let's go to Mark
3:08:15	11295	Mark
3:08:20	11300	8 34 And the text reads "And he summoned the m multitude
3:08:25	11305	with his disciples and said to them if anyone wishes to come after me let him
3:08:31	11311	deny himself take up his cross and follow me For whoever wishes to save his
3:08:38	11318	life shall lose it but whoever loses his life for my sake and the gospel shall save it."
3:08:45	11325	Okay How would this have been understood really really
3:09:00	11340	poorly um this would not have been received well at all
3:09:06	11346	Uh in fact what ends up happening is this sort of talk
3:09:13	11353	um loses a lot of his followers
3:09:19	11359	Okay this is just over their heads Um if anyone wishes to come after
3:09:27	11367	me let him deny himself and take up his cross take up his
3:09:33	11373	execution Right I mean this is this is this is as to to a first century
3:09:40	11380	Israelite this would be like saying the modern the modern equivalent of this was "Hey if you want to come do what I do
3:09:48	11388	yeah you're going to have to to to give up everything and bring your electric
3:09:56	11396	chair." Yeah Yeah How do you think that's going to go over
3:10:02	11402	um because the cross is the sign of the
3:10:08	11408	executioner Okay Yeah you're going to be executed So not only are you going to
3:10:14	11414	have to give up all the pleasures of this world you're going to be executed too Yeah This is this is not going to go
3:10:21	11421	over well And it didn't Um in fact there comes to a a
3:10:30	11430	point where you know where Christ is going to say to his
3:10:37	11437	disciples and his followers "Yeah if you want to follow me you've got to eat my
3:10:44	11444	flesh and drink my blood." Well you know this
3:10:50	11450	is to a Jew is really abhorrent because it sounds like cannibalism
3:10:57	11457	and the the the followers of Christ say "Okay this saying is way too hard I
3:11:05	11465	don't get it but it sounds weird I'm out of here." So most of the followers end up
3:11:11	11471	abandoning Christ And then Christ says to finally to his disciples "Hey are you going to
3:11:17	11477	abandon me too?" And it I think it's Peter who says to Christ "Well where where will we go
3:11:24	11484	you have the words of life So in some ways this is going to
3:11:30	11490	mark the division between who's a disciple and
3:11:36	11496	who's a follower You know I kind I I I kind of I
3:11:41	11501	kind of bristle when I hear churches sort of rebrand themselves say "Well
3:11:47	11507	we're not we're not Christians We're Christ followers." [Music]
3:11:53	11513	Oh what
3:11:59	11519	huh cuz the followers of Christ they left you know when when the going got
3:12:06	11526	rough they got going up and and left the
3:12:13	11533	building It's the disciples who stuck around
3:12:23	11543	So so but it was stuff like this where he basically tells them hey yeah you
3:12:30	11550	know you know verse 36 what does it profit a man to gain the whole world and
3:12:35	11555	forfeit his soul yeah that's that's tough language
3:12:43	11563	And it was really tough for an an a first century Israelite to to say "Oh
3:12:50	11570	because they they I mean Jerusalem Judea have been a wash with
3:12:58	11578	parapotetic preachers and false messiahs." Yeah Christ wasn't the first
3:13:06	11586	messiah There were many false messiahs in the first century many of
3:13:13	11593	them and they were so used to to false messiahs blowing them sunshine Here
3:13:20	11600	comes this Messiah that is basically saying "Yeah you follow me You're you're going to
3:13:27	11607	die." A lot of people just stopped and said "Um yeah this is too heavy I'm
3:13:32	11612	checking out of this." Yeah Yeah that's a message Yeah
3:13:38	11618	exactly
3:13:45	11625	So yeah um Harry Stark says those imposters are
3:13:50	11630	forgotten Yeah they're imp they were mostly forgotten but there were many of
3:13:57	11637	many of them Andrew Grim says "Yeah we still have
3:14:02	11642	false messiahs today." Yeah many false messiahs
3:14:10	11650	Oh yeah there's there's there's hundreds of false messiahs running around the landscape And there were back then too
3:14:15	11655	That's nothing new
3:14:20	11660	Yeah a lot of them are in California and Florida A lot
3:14:27	11667	[Laughter] Yeah Yeah The supposed antichrist dude
3:14:33	11673	Yeah You know I don't think that guy's the Antichrist either Um there there is one thing that I think um
3:14:41	11681	um like uh there's there's that uh was it his album or something like that yeah
3:14:47	11687	The fake uh uh Yeah Darth Beanie Yeah Yeah There's this guy who's
3:14:54	11694	claiming to be like the antichrist and the final revelation of of the Messiah and all that that's running around right
3:14:59	11699	now He's claiming to bring you know a kind of Chrislam to the world It's like
3:15:05	11705	no no that just that's he's just another false teacher He's not he's not the antichrist He's just another false
3:15:13	11713	teacher Yeah Um the earlier Yeah If you claim to be the
3:15:20	11720	Antichrist you're probably not Okay
3:15:26	11726	um like we like we discussed in in um Daniel chapter 11 you know the
3:15:33	11733	antichrist is going to be Oh yeah He said he sub he made all
3:15:39	11739	sorts of outrageous claims Yeah Um
3:15:47	11747	um but um like for example um you know if you want to know who the antichrist
3:15:52	11752	is the description was in was in Daniel um 11 that we talked about today you
3:15:58	11758	know his the the the god of the antichrist is is weapons
3:16:05	11765	of war you know that's that's one of the things we see like in the book of revelation you know it talks about the
3:16:11	11771	anti Christ and they say who can make war like the
3:16:17	11777	antichrist like for example here's here's one of the things I think is is um you know when when people start
3:16:22	11782	guessing who is the antichrist okay uh let's see here let me see if I can find the passage that's okay
3:16:35	11795	but find this quickly if I can find this quickly I'll just
3:16:53	11813	All right One of the things about the
3:16:59	11819	Antichrist is his ability to make war Okay Revelation 12:17 And the dragon
3:17:06	11826	emerged from the woman and went off to make war with the rest of her offspring who keeps the commandments of of Jesus
3:17:13	11833	uh and hold to the testimony of Jesus
3:17:19	11839	Okay Uh Revelation 13:7 And it was given to him to make war
3:17:25	11845	with the saints and overcome them And the authority over every tribe and people and tongue and nation was given
3:17:30	11850	to him Okay and I saw the beast and the kings of the
3:17:36	11856	earth and all their armies assembled to make war against him who sat upon the horse against his army Well one of the
3:17:41	11861	things about the about the beast the antichrist is his ability to make war If
3:17:48	11868	he's no good at war he's not the antichrist Just
3:17:53	11873	saying That's that's probably one of the major requirements of the Antichrist is he has to be good at warfare
3:18:04	11884	Yeah that's what rules out 90% of the politicians okay is most of the politicians are incompetent at
3:18:12	11892	war You know this is this is what I think is really really funny is
3:18:27	11907	um every election Okay Bubble machine What would be the point of claiming to
3:18:32	11912	be the antichrist it's a claim Okay this there there's actually there's a twisted there's a
3:18:38	11918	twisted logic to this Okay most people who claim to be the antichrist also
3:18:44	11924	claim to be the Christ Okay So the twisted logic here is if you
3:18:53	11933	claim to be the Christ a false me if you claim to be a messiah and you claim to be his anti is
3:19:02	11942	his opposite The antichrist you can claim to be the
3:19:08	11948	fulfillment or the consummation of the Christ consciousness
3:19:15	11955	That's the twisted logic in this okay is by claiming you be both the Christ and
3:19:22	11962	the Antichrist you can claim to be the consummation of both and therefore
3:19:28	11968	everyone should follow you That's the twisted logic here
3:19:36	11976	So he's he's he's not I mean when when when these
3:19:43	11983	these these clowns claim to be the antichrist they're not claiming to be the devil incarnate You know are you the devil's
3:19:51	11991	representative they're claiming to be the the ying and the
3:19:58	11998	yang So they're they're claiming to be both the say the the the
3:20:06	12006	the peaceloving elements of the Christ and the powerful elements of the dark
3:20:13	12013	side of the Christ the
3:20:20	12020	antichrist Uh bubble machine So Mary Sue got complex issues Yeah Yeah
3:20:29	12029	Mama Yikes They're two timing trying to play both sides Exactly Yeah Those who claim
3:20:35	12035	to be both Christ and Antichrist they're they're playing both sides
3:20:41	12041	They're infusing they're they're they're trying to infuse say this idea with
3:20:54	12054	um with this sort of say eastern motif of say dowoism
3:21:01	12061	So they're they're trying to appeal to they're basically importing a kind of Dowoism into Christianity and then
3:21:09	12069	trying to be the representative of Christianity through that importation Uh keeps learning will the
3:21:16	12076	Antichrist be a Jew not necessarily It's possible but not
3:21:22	12082	necessarily Uh we're not sure what his ethnicity will be Some people have
3:21:28	12088	speculated that he will be sort of a representative of of the tribe of Dan
3:21:33	12093	The idea being that tribe of Dan is excluded But that
3:21:39	12099	that's that's an inference and I don't think it's a very good inference So maybe he's a Jew maybe he isn't
3:21:46	12106	Doesn't we we're not sure We can't be sure Um the Bible just doesn't tell us here
3:22:00	12120	Okay So
3:22:09	12129	Andrew Go he'll be an Aussie Laugh out loud
3:22:15	12135	Yeah Yeah
3:22:23	12143	Um Scott War Antichrist equals an atheistic wararmongering anti-semite
3:22:29	12149	Well he'll definitely be wararmongering Uh not necessarily atheistic Okay Uh and he will be an
3:22:37	12157	anti-semite Okay He'll be an anti-semite he'll be anti-Christian he'll be both
3:22:43	12163	Um not necessarily atheistic Um
3:22:50	12170	um but he might have pretenses of atheism It for him it just seems to be that uh from the looks of it
3:22:57	12177	that he's going to sidestep
3:23:03	12183	religion It could just he just could be a humanist Yeah Yeah He could be a
3:23:08	12188	technobat Yeah He could be a lot of things Not necessarily atheist
3:23:15	12195	Yeah So any and and the real Antichrist isn't just going to is not going to just come
3:23:21	12201	out and say "Oh I'm the Antichrist I'm from the devil." No No He's not going to do that That's
3:23:28	12208	stupid It's why we're told how to recognize him is because he's not going
3:23:34	12214	to announce that he's the Antichrist If he's if he's announcing he's the Antichrist he's probably not the
3:23:39	12219	Antichrist
3:23:46	12226	Yeah
3:23:52	12232	Andrew Graham says from the looks of it he won't be dumb No he won't be stupid Oh no He'll he'll definitely not
3:23:59	12239	be stupid He'll be he'll be very savvy
3:24:04	12244	He'll be very cunning Um he will probably use a type of
3:24:11	12251	religion for his ends which is why he he rides the the beast of of Babylon He's
3:24:19	12259	he's riding religion but he isn't religious
3:24:24	12264	himself At least he doesn't he doesn't do a public religion His religion
3:24:31	12271	is the god of fortresses warfare That's his religion
3:24:45	12285	Okay See very progressive Okay Mama charmer charismatic
3:24:52	12292	high-risisk Yeah he probably will be He'll probably quite be be quite
3:24:58	12298	charming Yeah Yeah He'll be a narcissist and he will be very charismatic
3:25:06	12306	And and frankly his his disciples will be kings He has disciples and they will be
3:25:16	12316	kings He only he only prefers high class disciples Okay Uh next one here is from
3:25:24	12324	Messianic Talbad for $5 Thank you for the super chat How similar are the fights and squables of Egyptian gods
3:25:31	12331	similar to those of Greek mythology um they're not that similar to be
3:25:37	12337	honest Um Egyptian gods tend not to fight except in pretty special
3:25:46	12346	circumstances The only gods that we have on record actually fighting are
3:25:53	12353	um uh the the of course the the the um contesting between Horus and Seth and
3:26:01	12361	that's over kingship of Egypt Then we also have the daily um the daily
3:26:09	12369	battle of the sun god with the serpent Apous All right And that's pretty much
3:26:15	12375	the limits of fights and squables between Egyptian
3:26:22	12382	gods So there isn't this constant warfare happening between the gods like you do find in the Greek mythology In
3:26:29	12389	Greek mythology you do find constant infighting and bickering and battles and
3:26:36	12396	conniving and intrigue You know Mars oh sorry Uh Aries
3:26:42	12402	you know gets on the battlefield and of the gods and then cowers out and runs Um
3:26:48	12408	no no you don't find any of that Not in Egyptian in Egyptian
3:26:55	12415	mythology anyway
3:27:02	12422	Okay so I hope that helps Thank you for the super chat Very much appreciate
3:27:09	12429	it Right Messi Adam Talmud for $5 Thank you for the super chat Uh did Egyptian gods physically get
3:27:17	12437	women pregnant like the Olympians no Okay Um and there's a
3:27:23	12443	reason There's a reason Now there's a no and a yes answer to
3:27:29	12449	this too Okay if it's a king
3:27:34	12454	um the gods were said to have played a role in the conception of a
3:27:41	12461	king And how that works was um the god Cane put
3:27:50	12470	the soul of the king on the potter's wheel created man on the potter's
3:27:55	12475	wheel and then Ammon Alman Ray and Moot
3:28:01	12481	had mommy and daddy time conceive the
3:28:07	12487	king which the great queen and the physical
3:28:13	12493	king when they had their king and queen private
3:28:19	12499	time conceived and then the gods implanted
3:28:24	12504	the baby god king came into the great queen and she got pregnant that way
3:28:34	12514	Okay so that's the exception The rule is generally no
3:28:42	12522	Okay So that that's the only case where you have a god
3:28:49	12529	um getting a woman pregnant is through the conception of a
3:28:55	12535	king Everyone else was conceived the normal way Okay Um but here's the thing And
3:29:03	12543	here's the reason why you had less claims to um um
3:29:10	12550	uh physical conception by a god too And the reason is because in
3:29:21	12561	um in Greek society there was a stigma attached to
3:29:28	12568	unwed motherhood Okay because there was a stigma attached to it in Greek
3:29:34	12574	Hellenistic society Uh women did often claim that they were impregnated by a god
3:29:42	12582	essentially fooled by a god shaped like a man
3:29:48	12588	who you know bent her will and um you know seduced her because of his divine
3:29:56	12596	powers and she conceived uh through divine means Okay
3:30:05	12605	Now unwed motherhood in Egypt did not carry that
3:30:13	12613	stigma Because it didn't carry that stigma there were very few claims of
3:30:20	12620	divine conception among the general population
3:30:27	12627	So it's a cultural reason why it didn't happen in Egypt
3:30:32	12632	you you got those claims in the ancient world where there were these stigmas
3:30:37	12637	Okay So where you didn't have the stigma there was um there was a there was none
3:30:43	12643	of that those claims of say divine conception or very few at any
3:30:52	12652	rate and Egypt had no as I said Egypt did not have that
3:30:58	12658	that stigma applied to single motherhood Now that's not saying single motherhood
3:31:03	12663	was wasn't hard It was very very difficult and it was in every
3:31:10	12670	culture and it did force a woman to do
3:31:15	12675	certain things that she wouldn't have had to do normally But because there was no stigma
3:31:22	12682	attached to single motherhood in Egypt she could still
3:31:28	12688	marry Okay because there was no stigma attached to single uh motherhood So she could still marry a
3:31:35	12695	man and there were avenues out for uh where she could say pursue a a normal
3:31:43	12703	life though being a single mother was not a end of the line in Egyptian
3:31:50	12710	culture whereas say in Greek culture and in Israelite culture yeah it was it was
3:31:57	12717	a big problem if that happened
3:32:03	12723	So
3:32:08	12728	okay so so anyway I hope that answers your question Thank you very much for the super chat very much
3:32:24	12744	appreciated Okay Daniel for $5 Thank you very much for the super chat First Kings 3:2 Would one of these
3:32:31	12751	high places be Mount Eel let's talk about that All right Um first
3:32:40	12760	kings So first kings 3 verse two All
3:32:50	12770	right And it talks about here the people were still sacrificing on the high
3:32:55	12775	places because there was no house built for the name of the Lord until these day those days All right So it's getting
3:33:03	12783	ready to we're getting here ready This is the during the time of Solomon and they're getting ready to build the
3:33:09	12789	temple Now it would not have included Mount
3:33:15	12795	Eel Why because the Mount Eel site only lasted about 50 years
3:33:25	12805	Mount Eelles site was kind of remote for it to be a good high
3:33:30	12810	place Now it could have become a high place It had all the potential to be a
3:33:37	12817	high place It just ended not being a high place because it as I said it only
3:33:43	12823	lasted for about 50 years and then it was shut down You know they built two altars
3:33:48	12828	there and that was it you know so you know its span of time at Mount Ebel
3:33:55	12835	contextually was uh the late Bronze 2 early Iron Age one
3:34:01	12841	So you know by the time I mean the conquest hadn't even
3:34:07	12847	finished when by the time Mount Eel had shut down So Mount Ebel didn't last long as a
3:34:15	12855	site it it was a really short-lived site So it wouldn't count as the high
3:34:20	12860	one of the high places in First Kings 3:2 Um in First Kings 3:2 you're already
3:34:26	12866	talking about 200 years after the
3:34:31	12871	conquest So yeah you're really not you're really
3:34:36	12876	you're really talking about other sites at this point for high places Now let's talk about what a high place
3:34:43	12883	is because there's a lot of confusion about what a high place is
3:34:48	12888	Okay high place is not a place where people worshiped pagan
3:34:54	12894	gods What a high place is is and this is not talking about elevation Okay a high
3:35:03	12903	place is not necessarily on a mountain or a hill
3:35:09	12909	It's not high in geography it's high in
3:35:19	12919	religion Okay So
3:35:24	12924	uh it's it's so we're not talking about elevation here Now we do see this language happen like
3:35:31	12931	for example when Elijah you know um you know goes from
3:35:38	12938	um Jerusalem to Hebrron Okay you know he
3:35:43	12943	is sent to descend from Jerusalem to Hebrron Well Hebron's actually higher in
3:35:50	12950	elevation but religiously he is going from the high place in a higher place religiously in
3:35:57	12957	Jerusalem to the lower place religiously in Hebron
3:36:03	12963	Okay Um or not Hebron Bethl Bethl sorry So
3:36:10	12970	um so it's it's a high place here is not talking about a place of
3:36:15	12975	elevation but it's a place of religious um uh
3:36:22	12982	service Okay Now what a high place also is though is it's aberrant
3:36:29	12989	Yahwehism Okay It's a Yahwehism It's basically people going into these
3:36:36	12996	little cult sites and worshiping selfstyled
3:36:43	13003	Yahwehism Okay
3:36:48	13008	So so basically like Shiloh Shiloh was a high place Okay It's it was a it was a cult
3:36:57	13017	site It was re- um rededicated for the for the ha tabernacle Um it's not an
3:37:04	13024	elevated site but an ele high sight in elevation but it is a cult site that's a high place
3:37:15	13035	um basically places that had their own private Yahweh temples like at Hebrron
3:37:22	13042	like at Bethl you know those are those are high places
3:37:31	13051	So it's a place where people are not necessarily it's not a place where
3:37:36	13056	Yahweh was designated to be worshiped but people decided to build temples and
3:37:43	13063	chapels to Yahweh and worship there anyway and they're doing it their own
3:37:50	13070	way So what we're talking about here when we talk about high places is selfstyled Yahweh worship
3:37:57	13077	Okay The best way to to describe it is aberant Yahwehism It's not pagan as such It's
3:38:05	13085	not polytheistic as such It's still Yahweh worship It's just Yahweh worship
3:38:12	13092	that's not following the rules Okay So I hope that helps Thank you very
3:38:19	13099	much for super chat Very much
3:38:24	13104	appreciated Okay Next one here from Daniel for $10 Thank you for the super
3:38:30	13110	chat Are there any known ancient neareastern documents which were written composed in
3:38:38	13118	a way that source critics propose the penetuk was written JP D uh plus um he's
3:38:46	13126	talking here about the documentary hypothesis um the idea
3:38:51	13131	that you had multiple sources that are then sort of mashed
3:38:58	13138	together and then redacted constantly as they're being mashed together The short answer to this is
3:39:05	13145	no There is not a single document that was ever composed this way in the
3:39:11	13151	history of mankind Okay not one I have I have at least I am unaware
3:39:19	13159	of any document that was composed this way Now let's take one that has probably
3:39:26	13166	the longest pedigree of of of transmission
3:39:32	13172	and of composition longer than the Bible Okay let's talk about the book of the dead
3:39:41	13181	because we all love talking about the book of the dead Don't open the book of the
3:39:46	13186	dead Don't open the book
3:39:52	13192	That was very well done Yeah Okay Don't Don't open it
3:40:00	13200	[Laughter] So what do we have here with the book of the dead it started off as the pyramid
3:40:07	13207	texts The pyramid texts are basically a collection of magic spells Okay so you
3:40:13	13213	do have a collection of various spells and documents there Okay they're written
3:40:20	13220	on pyramids Okay fine
3:40:26	13226	Now that then goes into the coffin text Well the basically they go into the
3:40:33	13233	pyramids copy those texts and then start copying onto to coffins Not complete
3:40:41	13241	They're not complete text on the coffins but they take samples of these and they put them on on on the coffins Okay and
3:40:50	13250	then and they change slightly over time but you know some of that is organic
3:40:55	13255	change It's not it's not say intentional redaction as such They're not redacting those texts on when they put them on
3:41:02	13262	coffins but they are modifying them in slight ways to make them more appropriate for the person in the
3:41:09	13269	coffin Okay Then they take those coffin texts and they sort of gather them together again to make the book of the
3:41:17	13277	dead And the book of the dead um is codified
3:41:24	13284	into spells again And those spells remain pretty persistent over
3:41:32	13292	time They don't change much over thousands of years
3:41:39	13299	So that's the closest parallel we have
3:41:45	13305	to a documentary hypothesis scenario That's the closest we
3:41:51	13311	got where we have one set of text that are compiled modified
3:41:59	13319	slightly and then recompiled again But there's no ongoing process of
3:42:06	13326	redaction here There's no schools of redaction I don't know I mean the whole
